MCQ,Choices,Correct
Which of the following is NOT a core concept of AI?,a: Perception | b: Reasoning and Logic | c: Natural Language Processing | d: Human Emotion,d
What type of AI is designed to perform a specific task?,a: Narrow AI | b: General AI | c: Superintelligent AI | d: Expert Systems,a
Which branch of AI focuses on building intelligent robots?,a: Computer Vision | b: Robotics | c: Speech Recognition | d: Reinforcement Learning,b
What is a potential challenge associated with AI?,a: Bias in AI | b: Job Displacement | c: Ethical Dilemmas | d: All of the above,d
Which of the following is a key application of AI in healthcare?,a: Drug discovery | b: Predictive analytics | c: Robotic surgeries | d: All of the above,d
